@@,item,itemlabel,position,positionlabel,cabinet,startdate,enddate,psid
->,Q114869418,Abdel Nasser Al-Wali,Q28492175,Ministre de la Fonction publique et des Assurances->Ministre des Services civils et de l'Assurance Ministère des Services civils et de l'Assurance (Yémen),Q104601392,2020-12-18,,Q114869418-2FEECF0A-2D65-44A8-BC4B-278B53D49E86
->,Q114869769,Abdel Salam Hamid,Q28492183,Ministre des Transports->Ministre des Transports Ministère des Transports (Yémen),Q104601392,2020-12-17,,Q114869769-29438C86-0D9B-427F-B61F-13B8723FECBB
->,Q114869770,Abdelghani Jamil,Q114869362,Ministre chargé de Sanaa->Ministre du Secrétariat de Sana'a,Q104601392,2016-09-18,,Q114869770-C014A069-E499-47A3-A4CC-9AD310B4FFDE
---,Q16119688,Ahmed Awad Mubarak,Q28492176,ministre des Affaires expatriées,Q104601392,2020-12-26,,Q16119688-97ABF99B-528D-44C2-8FE2-977F243486E8
->,Q16119688,Ahmed Awad ben Moubarak,Q18345286,Ministre des Affaires étrangères->Ministre des Affaires étrangères Ministère des Affaires étrangères (Yémen),Q104601392,2020-12-18,,Q16119688-D796F264-0CD1-4740-88DE-36EA6234B5FF
---,Q114869638,Ahmed Mohamed Omar Orman,Q28492178,Ministre des Affaires juridiques,Q104601392,2020-12-17,,Q114869638-466681FA-A86F-44CE-B60E-74D13D87A9BC
+++,,Ahmed Mohamed Omar Orman,,Ministre des Affaires juridiques Ministère des Affaires juridiques (Yémen),Q104601392,,,
->,Q114869771,Badr al-Ardah,Q28492181,Ministre de la Justice->Ministre de la Justice Ministère de la Justice (Yémen),Q104601392,2020-12-17,,Q114869771-E5B5D1CC-3629-4E33-B2CA-EAF1B8698F3D
->,Q114869654,Hussein Abdul Rahman,Q28492152,Ministre de l'Administration locale->Ministre de l'Administration locale Ministère de l'Administration locale (Yémen),Q104601392,2020-12-17,,Q114869654-DD9E71AD-4FD1-4877-A8E5-45C30A5D42D7
->,Q113574719,Ibrahim Ali Ahmed Haidan,Q28481301,Ministre de l'Intérieur->Ministre de l'Intérieur (en),Q104601392,2020-12-17,,Q113574719-48DE5D7F-00B5-4445-9D29-A51B361C4983
---,Q114350102,Khaled Al-Wasabi,Q28492172,Ministre de l'Enseignement Supérieur et de la Recherche Scientifique,Q104601392,2020-12-17,,Q114350102-1CC9F355-244B-463B-8CC3-3DF4B945CB5A
---,Q114350102,Khaled Al-Wasabi,Q28492154,Ministre de l'Enseignement technique et Professionnel,Q104601392,2020-12-17,,Q114350102-01BF64A1-F9E2-4716-A6A5-4E842E0658EF
+++,,Khaled Al-Wasabi,,Ministre de l'Éducation technique et professionnelle,Q104601392,,,
+++,,Khaled Al-Wasabi,,Ministre de l'Éducation Supérieure et de la Recherche Scientifique (Yémen) Ministère de l'Éducation Supérieure et de la Recherche Scientifique (Yémen),Q104601392,,,
->,Q114869772,Manea Saleh,Q28492184,Ministre de l'Électricité->Ministre de l'Électricité et de l'Énergie Ministère de l'Électricité et de l'Énergie (Yémen),Q104601392,2022-07-28,,Q114869772-686132C9-AC0D-4D3B-B669-19458147F592
->,Q59334780,Marwan Damaj,Q28492162,Ministre de la Culture->Ministre de la Culture Ministère de la Culture (Yémen),Q104601392,2020-12-26,,Q59334780-85E48583-AE40-4332-8A8D-CE95A67204B7
---,Q16127851,Moammar Al-Eryani,Q28492162,ministre de la Culture,Q104601392,2020-12-17,,Q16127851-05B82007-7808-437C-941A-039B4C3A14C2
->,Q104601317,Mohamed Ahmed Shabiba,Q28492150,Ministre des Dotations religieuses et de l'Orientation->Ministre des Dotations et de l'Orientation Ministère des Dotations et de l'Orientation (Yémen),Q104601392,2020-12-26,,Q104601317-5365165d-406c-b736-d630-81418fe663cd
---,Q114869664,Mohamed Al-Ashwal,Q28492170,ministre de l'Industrie et du Commerce,Q104601392,2020-12-17,,Q114869664-61A6D013-A179-4C11-BE46-5C2CB0DEA108
+++,,Mohamed al-Ashwal,,Ministre de l'Industrie et du Commerce Ministère de l'Industrie et du Commerce (Yémen),Q104601392,,,
->,Q113407477,Mohsen Mohammed Hussein al-Daeri,Q24810166,Ministre de la Défense->Ministre de la Défense (en),Q104601392,2022-07-28,,Q113407477-E855DB00-046B-49C2-8439-169B4B7ECB08
---,Q16127851,Muammar al-Iryani,Q28492159,Ministre du Tourisme,Q104601392,2020-12-17,,Q16127851-CEEB9612-2395-4C9B-B406-949BF25EB563
---,Q16127851,Muammar al-Iryani,Q28492156,Ministre de l'Information,Q104601392,2016-09-18,,Q16127851-79E2F33C-E71F-4BA5-8827-1872CB6CDBE1
+++,,Muammar al-Iryani,,Ministre du Tourisme Ministère du Tourisme (Yémen),Q104601392,,,
+++,,Muammar al-Iryani,,Ministre de l'Information Ministère de l'Information (Yémen),Q104601392,,,
->,Q114869699,Muhammad Al-Zaouri,Q28492173,Ministre des Affaires sociales et du Travail->Ministre des Affaires sociales et de Travail Ministère des Affaires sociales et de Travail (Yémen),Q104601392,2020-12-17,,Q114869699-90E361A0-8E1C-4C8F-AB09-72887BE6431C
---,Q59246326,Najeeb Mansour Hameed Al Auj,Q28492151,ministre de la Communication,Q104601392,2020-12-18,,Q59246326-2dd971d5-40a9-18e2-084c-806449890931
+++,,Najib al-Awj,,Ministre des Télécommunications et de la Technologie de l'information Ministère des Télécommunications et de la Technologie de l'information (Yémen),Q104601392,,,
->,Q21680111,Nayef al-Bakri,Q28492158,Ministre de la Jeunesse et des Sports->Ministre de la Jeunesse et des Sports Ministère de la Jeunesse et des Sports (Yémen),Q104601392,2015-09-15,,Q21680111-A07252DF-9824-46E3-9024-039A198C5AE2
->,Q114869710,Qassem Mohammad Qassem Baheeh,Q28492164,Ministre de la Santé->Ministre de la Santé Publique et de la Population Ministère de la Santé Publique et de la Population,Q104601392,2020-12-17,,Q114869710-B3DE8E04-C753-42C4-9D92-1D6E05668017
->,Q114869724,Said Suliman Barakat al-Shamasi,Q28492179,Ministre du Pétrole et des Minéraux->Ministre du Pétrole et des Minéraux Ministère du Pétrole et des Minéraux (Yémen),Q104601392,2022-07-28,,Q114869724-3E7302A9-688F-4A36-A6AB-6716D3D81718
---,Q114869735,Salem Abdullah Issa Al-Soqotri,Q28492155,Ministre de l'Agriculture et de l'Irrigation,Q104601392,2020-12-17,,Q114869735-A79FBDF5-B971-4FEB-AE6E-4B7AE51E27DD
---,Q114869735,Salem Abdullah Issa Al-Soqotri,Q28492157,ministre de la Pêche,Q104601392,2020-12-17,,Q114869735-8E71D130-94B1-43C3-87A3-DA251FD9E972
+++,,Salem Abdullah Issa Al-Soqotri,,Ministre des Richesses de la pêche,Q104601392,,,
+++,,Salem Abdullah Issa Al-Soqotri,,Ministre de l'Agriculture et de l'Irrigation Ministère de l'Agriculture et de l'Irrigation (Yémen),Q104601392,,,
->,Q68837007,Salem Saleh Bin Braik,Q28492161,Ministère des Finances->Ministre des Finances Ministère des Finances (Yémen),Q104601392,2019-09-19,,Q68837007-9E32BD0D-9C5B-4F10-A9B4-447637D0C778
->,Q114869775,Salim Mohammed,Q28492149,Ministre des Travaux publics et des Infrastructures->Ministre des Travaux publics et des Transports Ministère des Travaux publics et des Transports (Yémen),Q104601392,2022-07-28,,Q114869775-E2D4B300-2297-49D3-8F20-A034ED5B54B5
---,Q114869756,Tareq Salem Al-Abkari,Q28492165,ministre de l'Éducation,Q104601392,2020-12-17,,Q114869756-A18C28AC-0BA6-4979-A061-922E04F3CAD3
+++,,Tareq Salem al-Abkari,,Ministre de l'Éducation Ministère de l'Éducation (Yémen),Q104601392,,,
---,Q114869762,Tawfiq Al-Sharjabi,Q28492167,ministre de l'Eau et de l'Environnement,Q104601392,2020-12-17,,Q114869762-EDDA047D-4C83-4FDC-892E-D49D2CC3EC23
+++,,Tawfiq al-Sharjabi,,Ministre de l'Eau et de l'Environnement Ministère de l'Eau et de l'Environnement (Yémen),Q104601392,,,
+++,,Waed Abdullah Badhib,,Ministre de la Planification et de la Coopération internationale Ministère de la Planification et de la Coopération internationale (Yémen),Q104601392,,,
---,Q22690657,Waed Badhib,Q28492160,ministre de la Planification et de la Coopération internationale,Q104601392,2020-12-18,,Q22690657-296746d0-4847-bdb4-8a92-da46d1b6f9c5
